{"schemaVersion":1,"generatedAtUtc":"2026-07-14T14:06:23Z","provider":{"id":"twelve-data","name":"Twelve Data","sourceUrl":"https://twelvedata.com/","access":"credentialed-server-side","licenseMode":"private-internal-use-only","status":"unavailable","disclaimer":"Provider data is collected by GitHub Actions for an access-controlled internal dashboard. Do not enable while the repository or deployed site is publicly accessible."},"collection":{"mode":"disabled","status":"unavailable","expectedCadence":"Intraday snapshots during the US session and one daily history refresh","lastSuccessfulAt":null,"successCount":0,"failureCount":31,"errors":["Awaiting a private repository, protected Cloudflare deployment and explicit private-feed activation."]},"watchlist":[{"id":"nvda","symbol":"NVDA","name":"NVIDIA","exchange":"NASDAQ","group":"Semiconductors","currency":"USD","status":"unavailable","observedAt":null,"collectedAt":"2026-07-14T14:06:23Z","price":null,"sourceUrl":"https://twelvedata.com/","error":null},{"id":"amd","symbol":"AMD","name":"Advanced Micro Devices","exchange":"NASDAQ","group":"Semiconductors","currency":"USD","status":"unavailable","observedAt":null,"collectedAt":"2026-07-14T14:06:23Z","price":null,"sourceUrl":"https://twelvedata.com/","error":null},{"id":"avgo","symbol":"AVGO","name":"Broadcom","exchange":"NASDAQ","group":"Semiconductors","currency":"USD","status":"unavailable","observedAt":null,"collectedAt":"2026-07-14T14:06:23Z","price":null,"sourceUrl":"https://twelvedata.com/","error":null},{"id":"tsm","symbol":"TSM","name":"Taiwan Semiconductor ADR","exchange":"NYSE","group":"Semiconductors","currency":"USD","status":"unavailable","observedAt":null,"collectedAt":"2026-07-14T14:06:23Z","price":null,"sourceUrl":"https://twelvedata.com/","error":null},{"id":"asml","symbol":"ASML","name":"ASML Holding ADR","exchange":"NASDAQ","group":"Semiconductors","currency":"USD","status":"unavailable","observedAt":null,"collectedAt":"2026-07-14T14:06:23Z","price":null,"sourceUrl":"https://twelvedata.com/","error":null},{"id":"mu","symbol":"MU","name":"Micron Technology","exchange":"NASDAQ","group":"Semiconductors","currency":"USD","status":"unavailable","observedAt":null,"collectedAt":"2026-07-14T14:06:23Z","price":null,"sourceUrl":"https://twelvedata.com/","error":null},{"id":"amat","symbol":"AMAT","name":"Applied Materials","exchange":"NASDAQ","group":"Semiconductors","currency":"USD","status":"unavailable","observedAt":null,"collectedAt":"2026-07-14T14:06:23Z","price":null,"sourceUrl":"https://twelvedata.com/","error":null},{"id":"lrcx","symbol":"LRCX","name":"Lam Research","exchange":"NASDAQ","group":"Semiconductors","currency":"USD","status":"unavailable","observedAt":null,"collectedAt":"2026-07-14T14:06:23Z","price":null,"sourceUrl":"https://twelvedata.com/","error":null},{"id":"klac","symbol":"KLAC","name":"KLA","exchange":"NASDAQ","group":"Semiconductors","currency":"USD","status":"unavailable","observedAt":null,"collectedAt":"2026-07-14T14:06:23Z","price":null,"sourceUrl":"https://twelvedata.com/","error":null},{"id":"qcom","symbol":"QCOM","name":"Qualcomm","exchange":"NASDAQ","group":"Semiconductors","currency":"USD","status":"unavailable","observedAt":null,"collectedAt":"2026-07-14T14:06:23Z","price":null,"sourceUrl":"https://twelvedata.com/","error":null},{"id":"arm","symbol":"ARM","name":"Arm Holdings ADR","exchange":"NASDAQ","group":"Semiconductors","currency":"USD","status":"unavailable","observedAt":null,"collectedAt":"2026-07-14T14:06:23Z","price":null,"sourceUrl":"https://twelvedata.com/","error":null},{"id":"intc","symbol":"INTC","name":"Intel","exchange":"NASDAQ","group":"Semiconductors","currency":"USD","status":"unavailable","observedAt":null,"collectedAt":"2026-07-14T14:06:23Z","price":null,"sourceUrl":"https://twelvedata.com/","error":null},{"id":"mp","symbol":"MP","name":"MP Materials","exchange":"NYSE","group":"Rare Earths & Critical Minerals","currency":"USD","status":"unavailable","observedAt":null,"collectedAt":"2026-07-14T14:06:23Z","price":null,"sourceUrl":"https://twelvedata.com/","error":null},{"id":"uuuu","symbol":"UUUU","name":"Energy Fuels","exchange":"NYSE American","group":"Rare Earths & Critical Minerals","currency":"USD","status":"unavailable","observedAt":null,"collectedAt":"2026-07-14T14:06:23Z","price":null,"sourceUrl":"https://twelvedata.com/","error":null},{"id":"usar","symbol":"USAR","name":"USA Rare Earth","exchange":"NASDAQ","group":"Rare Earths & Critical Minerals","currency":"USD","status":"unavailable","observedAt":null,"collectedAt":"2026-07-14T14:06:23Z","price":null,"sourceUrl":"https://twelvedata.com/","error":null},{"id":"nb","symbol":"NB","name":"NioCorp Developments","exchange":"NASDAQ","group":"Rare Earths & Critical Minerals","currency":"USD","status":"unavailable","observedAt":null,"collectedAt":"2026-07-14T14:06:23Z","price":null,"sourceUrl":"https://twelvedata.com/","error":null},{"id":"crml","symbol":"CRML","name":"Critical Metals Corp.","exchange":"NASDAQ","group":"Rare Earths & Critical Minerals","currency":"USD","status":"unavailable","observedAt":null,"collectedAt":"2026-07-14T14:06:23Z","price":null,"sourceUrl":"https://twelvedata.com/","error":null},{"id":"alb","symbol":"ALB","name":"Albemarle","exchange":"NYSE","group":"Rare Earths & Critical Minerals","currency":"USD","status":"unavailable","observedAt":null,"collectedAt":"2026-07-14T14:06:23Z","price":null,"sourceUrl":"https://twelvedata.com/","error":null},{"id":"sqm","symbol":"SQM","name":"Sociedad Quimica y Minera ADR","exchange":"NYSE","group":"Rare Earths & Critical Minerals","currency":"USD","status":"unavailable","observedAt":null,"collectedAt":"2026-07-14T14:06:23Z","price":null,"sourceUrl":"https://twelvedata.com/","error":null},{"id":"lyc","symbol":"LYC","name":"Lynas Rare Earths","exchange":"ASX","group":"Rare Earths & Critical Minerals","currency":"AUD","status":"unavailable","observedAt":null,"collectedAt":"2026-07-14T14:06:23Z","price":null,"sourceUrl":"https://twelvedata.com/","error":null},{"id":"aru","symbol":"ARU","name":"Arafura Rare Earths","exchange":"ASX","group":"Rare Earths & Critical Minerals","currency":"AUD","status":"unavailable","observedAt":null,"collectedAt":"2026-07-14T14:06:23Z","price":null,"sourceUrl":"https://twelvedata.com/","error":null},{"id":"ilu","symbol":"ILU","name":"Iluka Resources","exchange":"ASX","group":"Rare Earths & Critical Minerals","currency":"AUD","status":"unavailable","observedAt":null,"collectedAt":"2026-07-14T14:06:23Z","price":null,"sourceUrl":"https://twelvedata.com/","error":null},{"id":"bhp","symbol":"BHP","name":"BHP ADR","exchange":"NYSE","group":"Diversified Mining","currency":"USD","status":"unavailable","observedAt":null,"collectedAt":"2026-07-14T14:06:23Z","price":null,"sourceUrl":"https://twelvedata.com/","error":null},{"id":"rio","symbol":"RIO","name":"Rio Tinto ADR","exchange":"NYSE","group":"Diversified Mining","currency":"USD","status":"unavailable","observedAt":null,"collectedAt":"2026-07-14T14:06:23Z","price":null,"sourceUrl":"https://twelvedata.com/","error":null},{"id":"fcx","symbol":"FCX","name":"Freeport-McMoRan","exchange":"NYSE","group":"Diversified Mining","currency":"USD","status":"unavailable","observedAt":null,"collectedAt":"2026-07-14T14:06:23Z","price":null,"sourceUrl":"https://twelvedata.com/","error":null},{"id":"spy","symbol":"SPY","name":"SPDR S&P 500 ETF","exchange":"NYSE Arca","group":"Benchmarks & ETFs","currency":"USD","status":"unavailable","observedAt":null,"collectedAt":"2026-07-14T14:06:23Z","price":null,"sourceUrl":"https://twelvedata.com/","error":null},{"id":"qqq","symbol":"QQQ","name":"Invesco QQQ Trust","exchange":"NASDAQ","group":"Benchmarks & ETFs","currency":"USD","status":"unavailable","observedAt":null,"collectedAt":"2026-07-14T14:06:23Z","price":null,"sourceUrl":"https://twelvedata.com/","error":null},{"id":"smh","symbol":"SMH","name":"VanEck Semiconductor ETF","exchange":"NASDAQ","group":"Benchmarks & ETFs","currency":"USD","status":"unavailable","observedAt":null,"collectedAt":"2026-07-14T14:06:23Z","price":null,"sourceUrl":"https://twelvedata.com/","error":null},{"id":"soxx","symbol":"SOXX","name":"iShares Semiconductor ETF","exchange":"NASDAQ","group":"Benchmarks & ETFs","currency":"USD","status":"unavailable","observedAt":null,"collectedAt":"2026-07-14T14:06:23Z","price":null,"sourceUrl":"https://twelvedata.com/","error":null},{"id":"remx","symbol":"REMX","name":"VanEck Rare Earth and Strategic Metals ETF","exchange":"NYSE Arca","group":"Benchmarks & ETFs","currency":"USD","status":"unavailable","observedAt":null,"collectedAt":"2026-07-14T14:06:23Z","price":null,"sourceUrl":"https://twelvedata.com/","error":null},{"id":"copx","symbol":"COPX","name":"Global X Copper Miners ETF","exchange":"NYSE Arca","group":"Benchmarks & ETFs","currency":"USD","status":"unavailable","observedAt":null,"collectedAt":"2026-07-14T14:06:23Z","price":null,"sourceUrl":"https://twelvedata.com/","error":null}],"sourceStatus":[{"id":"twelve-data-api","source":"Twelve Data private market feed","status":"unavailable","observationDate":null,"lastSuccessfulAt":null,"expectedCadence":"Intraday snapshots plus daily full history","detail":"Awaiting a private repository, protected Cloudflare deployment and explicit private-feed activation.","error":"Awaiting a private repository, protected Cloudflare deployment and explicit private-feed activation.","url":"https://twelvedata.com/"}],"methodology":{"price":"Latest accepted quote close, otherwise latest accepted daily close.","returns":"Trading-session comparisons using 1, 5, 21, 63 and 252-session references where available.","trend":"Rule-based price and 20/50/200-session moving-average alignment; not a recommendation.","retention":"A failed symbol retains its last verified row with stale status rather than being erased."}}
